
			=====lsusb=====

Bus 001 Device 004: ID 045e:07f8 Microsoft Corp. Wired Keyboard 600 (model 1576)
Bus 001 Device 006: ID 1d57:0005 Xenta Wireless Receiver (Keyboard and Mouse)
Bus 001 Device 012: ID 2357:0115 TP-Link 
Bus 001 Device 013: ID 2357:010c TP-Link TL-WN722N v2
Bus 001 Device 005: ID 05e3:0610 Genesys Logic, Inc. 4-port hub
Bus 001 Device 008: ID 0424:7800 Microchip Technology, Inc. (formerly SMSC) 
Bus 001 Device 003: ID 0424:2514 Microchip Technology, Inc. (formerly SMSC) USB 2.0 Hub
Bus 001 Device 002: ID 0424:2514 Microchip Technology, Inc. (formerly SMSC) USB 2.0 Hub
Bus 001 Device 001: ID 1d6b:0002 Linux Foundation 2.0 root hub

			====


			====iwconfig===

wlan0     IEEE 802.11  ESSID:"iPhone"  
          Mode:Managed  Frequency:2.412 GHz  Access Point: 8E:75:9D:A4:87:DF   
          Bit Rate=24 Mb/s   Tx-Power=31 dBm   
          Retry short limit:7   RTS thr:off   Fragment thr:off
          Encryption key:off
          Power Management:on
          Link Quality=70/70  Signal level=-40 dBm  
          Rx invalid nwid:0  Rx invalid crypt:0  Rx invalid frag:0
          Tx excessive retries:1  Invalid misc:0   Missed beacon:0

eth0      no wireless extensions.

lo        no wireless extensions.

wlan1     IEEE 802.11  ESSID:off/any  
          Mode:Managed  Access Point: Not-Associated   Tx-Power=18 dBm   
          Retry short limit:7   RTS thr:off   Fragment thr:off
          Encryption key:off
          Power Management:off
          
wlan2     unassociated  ESSID:""  Nickname:"<WIFI@REALTEK>"
          Mode:Managed  Frequency=2.412 GHz  Access Point: Not-Associated   
          Sensitivity:0/0  
          Retry:off   RTS thr:off   Fragment thr:off
          Encryption key:off
          Power Management:off
          Link Quality=0/100  Signal level=0 dBm  Noise level=0 dBm
          Rx invalid nwid:0  Rx invalid crypt:0  Rx invalid frag:0
          Tx excessive retries:0  Invalid misc:0   Missed beacon:0


			====iw dev====

phy#2
        Interface wlan1
                ifindex 6
                wdev 0x200000001
                addr 32:5d:df:5d:5b:79
                type managed
                txpower 18.00 dBm
phy#0
        Unnamed/non-netdev interface
                wdev 0x2
                addr be:91:f9:9a:d0:9b
                type P2P-device
                txpower 31.00 dBm
        Interface wlan0
                ifindex 3
                wdev 0x1
                addr b8:27:eb:d4:7a:2b
                ssid iPhone
                type managed
                channel 1 (2412 MHz), width: 20 MHz, center1: 2412 MHz

			=====lshw====

  *-usbhost
       product: DWC OTG Controller
       vendor: Linux 4.19.118-Re4son-v8+ dwc_otg_hcd
       physical id: 1
       bus info: usb@1
       logical name: usb1
       version: 4.19
       capabilities: usb-2.00
       configuration: driver=hub slots=1 speed=480Mbit/s
     *-usb
          description: USB hub
          product: USB 2.0 Hub
          vendor: Microchip Technology, Inc. (formerly SMSC)
          physical id: 1
          bus info: usb@1:1
          version: b.b3
          capabilities: usb-2.00
          configuration: driver=hub maxpower=2mA slots=4 speed=480Mbit/s
        *-usb:0
             description: USB hub
             product: USB 2.0 Hub
             vendor: Microchip Technology, Inc. (formerly SMSC)
             physical id: 1
             bus info: usb@1:1.1
             version: b.b3
             capabilities: usb-2.00
             configuration: driver=hub maxpower=2mA slots=3 speed=480Mbit/s
           *-usb:0
                description: Ethernet interface
                vendor: Microchip Technology, Inc. (formerly SMSC)
                physical id: 1
                bus info: usb@1:1.1.1
                logical name: eth0
                version: 3.00
                serial: b8:27:eb:81:2f:7e
                size: 10Mbit/s
                capacity: 1Gbit/s
                capabilities: usb-2.10 ethernet physical tp mii 10bt 10bt-fd 100bt 100bt-fd 1000bt-fd autonegotiation
                configuration: autonegotiation=on broadcast=yes driver=lan78xx duplex=half link=no maxpower=2mA multicast=yes port=MII speed=10Mbit/s
           *-usb:1
                description: USB hub
                product: USB2.0 Hub
                vendor: GenesysLogic
                physical id: 2
                bus info: usb@1:1.1.2
                version: 92.24
                capabilities: usb-2.00
                configuration: driver=hub maxpower=100mA slots=4 speed=480Mbit/s
              *-usb:0
                   description: Generic USB device
                   product: 802.11n NIC
                   vendor: Realtek
                   physical id: 1
                   bus info: usb@1:1.1.2.1
                   version: 0.00
                   serial: 00E04C0001
                   capabilities: usb-2.00
                   configuration: driver=r8188eu maxpower=500mA speed=480Mbit/s
              *-usb:1
                   description: Generic USB device
                   product: 802.11ac NIC
                   vendor: Realtek
                   physical id: 4
                   bus info: usb@1:1.1.2.4
                   version: 2.10
                   serial: 123456
                   capabilities: usb-2.10
                   configuration: driver=rtl88xxau maxpower=500mA speed=480Mbit/s
           *-usb:2
                description: Mouse
                product: HID-compliant Mouse
                vendor: HID-compliant Mouse
                physical id: 3
                bus info: usb@1:1.1.3
                version: 1.00
                capabilities: usb-1.10
                configuration: driver=usbhid maxpower=100mA speed=12Mbit/s
        *-usb:1
             description: Keyboard
             product: Wired Keyboard 600
             vendor: Microsoft
             physical id: 3
             bus info: usb@1:1.3
             version: 3.00
             capabilities: usb-2.00
             configuration: driver=usbhid maxpower=100mA speed=2Mbit/s
  *-network:0
       description: Wireless interface
       physical id: 2
       logical name: wlan0
       serial: b8:27:eb:d4:7a:2b
       capabilities: ethernet physical wireless
       configuration: broadcast=yes driver=brcmfmac driverversion=7.45.154 firmware=01-4fbe0b04 ip=172.20.10.7 multicast=yes wireless=IEEE 802.11
  *-network:1 DISABLED
       description: Wireless interface
       physical id: 3
       bus info: usb@1:1.1.2.4
       logical name: wlan1
       serial: 32:5d:df:5d:5b:79
       capabilities: ethernet physical wireless
       configuration: broadcast=yes driver=rtl88xxau multicast=yes wireless=IEEE 802.11
  *-network:2
       description: Wireless interface
       physical id: 4
       bus info: usb@1:1.1.2.1
       logical name: wlan2
       serial: 50:3e:aa:00:45:dd
       capabilities: ethernet physical wireless
       configuration: broadcast=yes driver=r8188eu multicast=yes wireless=unassociated

				====usb-devices====

 Bus=01 Lev=03 Prnt=03 Port=01 Cnt=02 Dev#=  5 Spd=480 MxCh= 4
D:  Ver= 2.00 Cls=09(hub  ) Sub=00 Prot=02 MxPS=64 #Cfgs=  1
P:  Vendor=05e3 ProdID=0610 Rev=92.24
S:  Manufacturer=GenesysLogic
S:  Product=USB2.0 Hub
C:  #Ifs= 1 Cfg#= 1 Atr=e0 MxPwr=100mA
I:  If#=0x0 Alt= 1 #EPs= 1 Cls=09(hub  ) Sub=00 Prot=02 Driver=hub

T:  Bus=01 Lev=04 Prnt=05 Port=00 Cnt=01 Dev#= 13 Spd=480 MxCh= 0
D:  Ver= 2.00 Cls=00(>ifc ) Sub=00 Prot=00 MxPS=64 #Cfgs=  1
P:  Vendor=2357 ProdID=010c Rev=00.00
S:  Manufacturer=Realtek
S:  Product=802.11n NIC
S:  SerialNumber=00E04C0001
C:  #Ifs= 1 Cfg#= 1 Atr=a0 MxPwr=500mA
I:  If#=0x0 Alt= 0 #EPs= 3 Cls=ff(vend.) Sub=ff Prot=ff Driver=r8188eu

T:  Bus=01 Lev=04 Prnt=05 Port=03 Cnt=02 Dev#= 12 Spd=480 MxCh= 0
D:  Ver= 2.10 Cls=00(>ifc ) Sub=00 Prot=00 MxPS=64 #Cfgs=  1
P:  Vendor=2357 ProdID=0115 Rev=02.10
S:  Manufacturer=Realtek
S:  Product=802.11ac NIC
S:  SerialNumber=123456
C:  #Ifs= 1 Cfg#= 1 Atr=80 MxPwr=500mA
I:  If#=0x0 Alt= 0 #EPs= 5 Cls=ff(vend.) Sub=ff Prot=ff Driver=rtl88xxau

T:  Bus=01 Lev=03 Prnt=03 Port=02 Cnt=03 Dev#=  6 Spd=12  MxCh= 0
D:  Ver= 1.10 Cls=00(>ifc ) Sub=00 Prot=00 MxPS= 8 #Cfgs=  1
P:  Vendor=1d57 ProdID=0005 Rev=01.00
S:  Manufacturer=HID-compliant Mouse
S:  Product=HID-compliant Mouse
C:  #Ifs= 1 Cfg#= 1 Atr=a0 MxPwr=100mA
I:  If#=0x0 Alt= 0 #EPs= 1 Cls=03(HID  ) Sub=01 Prot=02 Driver=usbhid

T:  Bus=01 Lev=02 Prnt=02 Port=02 Cnt=02 Dev#=  4 Spd=1.5 MxCh= 0
D:  Ver= 2.00 Cls=00(>ifc ) Sub=00 Prot=00 MxPS= 8 #Cfgs=  1
P:  Vendor=045e ProdID=07f8 Rev=03.00
S:  Manufacturer=Microsoft
S:  Product=Wired Keyboard 600
C:  #Ifs= 2 Cfg#= 1 Atr=a0 MxPwr=100mA
I:  If#=0x0 Alt= 0 #EPs= 1 Cls=03(HID  ) Sub=01 Prot=01 Driver=usbhid
I:  If#=0x1 Alt= 0 #EPs= 1 Cls=03(HID  ) Sub=00 Prot=00 Driver=usbhid
